------------- WELCOME TO ADDRESS BOOK MANAGEMENT USING SQL DATABASE -------------

-------------- UC 1 --------------
---- Ability to create a Address Book Service DB ----

mysql> show databases;
+---------------------+
| Database            |
+---------------------+
| demo                |
| demo2               |
| department_database |
| information_schema  |
| mysql               |
| payroll_service     |
| performance_schema  |
| sys                 |
+---------------------+
8 rows in set (0.00 sec)

mysql> create database AddressBook_service;
Query OK, 1 row affected (0.09 sec)

mysql> show databases;
+---------------------+
| Database            |
+---------------------+
| addressbook_service |
| demo                |
| demo2               |
| department_database |
| information_schema  |
| mysql               |
| payroll_service     |
| performance_schema  |
| sys                 |
+---------------------+
9 rows in set (0.00 sec)

mysql>
----------- END OF UC 1 -----------


----------- UC 2 -----------
---- TO CREATE A TABLE WITH FOLLOWING ATTRIBUTES ----

mysql> create table addressBook_db(
    -> First_Name varchar(20),
    -> Last_Name varchar(20),
    -> Address varchar(50),
    -> City varchar(20),
    -> State varchar(50),
    -> Zip int(10),
    -> Phone_Number int(20),
    -> Email varchar(50)
    -> );
Query OK, 0 rows affected, 2 warnings (0.17 sec)

mysql> desc addressbook_db;
+--------------+-------------+------+-----+---------+-------+
| Field        | Type        | Null | Key | Default | Extra |
+--------------+-------------+------+-----+---------+-------+
| First_Name   | varchar(20) | YES  |     | NULL    |       |
| Last_Name    | varchar(20) | YES  |     | NULL    |       |
| Address      | varchar(50) | YES  |     | NULL    |       |
| City         | varchar(20) | YES  |     | NULL    |       |
| State        | varchar(50) | YES  |     | NULL    |       |
| Zip          | int         | YES  |     | NULL    |       |
| Phone_Number | int         | YES  |     | NULL    |       |
| Email        | varchar(50) | YES  |     | NULL    |       |
+--------------+-------------+------+-----+---------+-------+
8 rows in set (0.00 sec)

mysql>
----------- END OF UC 2 -----------


----------- UC 3 -----------
---- TO ADD NEW CONTACTS IN THE ADDRESS BOOK TABLE----

mysql> insert into addressbook_db (First_Name, Last_Name, Address, City, State, Zip, Phone_Number, Email) values("Pranshu", "Chaurasia", "Talwandi", "Kota", "Rajasthan", 324005, 123456, "pranshu.1@gmail.com");
Query OK, 1 row affected (0.10 sec)

mysql> insert into addressbook_db (First_Name, Last_Name, Address, City, State, Zip, Phone_Number, Email) values("John", "Doe", "Mansarover", "Jaipur", "Rajasthan", 300456, 654789, "john.doe@gmail.com");
Query OK, 1 row affected (0.08 sec)

mysql> insert into addressbook_db (First_Name, Last_Name, Address, City, State, Zip, Phone_Number, Email) values("Raj", "Jain", "Andheri", "Mumbai", "Maharashtra", 456781, 321478, "raj.3@gmail.com");
Query OK, 1 row affected (0.09 sec)

mysql> select * from addressbook_db;
+------------+-----------+------------+--------+-------------+--------+--------------+---------------------+
| First_Name | Last_Name | Address    | City   | State       | Zip    | Phone_Number | Email               |
+------------+-----------+------------+--------+-------------+--------+--------------+---------------------+
| Pranshu    | Chaurasia | Talwandi   | Kota   | Rajasthan   | 324005 |       123456 | pranshu.1@gmail.com |
| John       | Doe       | Mansarover | Jaipur | Rajasthan   | 300456 |       654789 | john.doe@gmail.com  |
| Raj        | Jain      | Andheri    | Mumbai | Maharashtra | 456781 |       321478 | raj.3@gmail.com     |
+------------+-----------+------------+--------+-------------+--------+--------------+---------------------+
3 rows in set (0.00 sec)
mysql>
----------- END OF UC 3 -----------


----------- UC 4 -----------
---- TO EDIT ENTRIES IN EXISTING CONTACTS USING THEIR NAME ----

mysql> update addressbook_db set Phone_Number =  90909090 where First_Name = "Pranshu";
Query OK, 1 row affected (0.07 sec)
Rows matched: 1  Changed: 1  Warnings: 0

mysql> update addressbook_db set Phone_Number =  70070070 where First_Name = "John";
Query OK, 1 row affected (0.05 sec)
Rows matched: 1  Changed: 1  Warnings: 0

mysql> update addressbook_db set Phone_Number =  80808080 where First_Name = "Raj";
Query OK, 1 row affected (0.16 sec)
Rows matched: 1  Changed: 1  Warnings: 0

mysql> select * from addressbook_db;
+------------+-----------+------------+--------+-------------+--------+--------------+---------------------+
| First_Name | Last_Name | Address    | City   | State       | Zip    | Phone_Number | Email               |
+------------+-----------+------------+--------+-------------+--------+--------------+---------------------+
| Pranshu    | Chaurasia | Talwandi   | Kota   | Rajasthan   | 324005 |     90909090 | pranshu.1@gmail.com |
| John       | Doe       | Mansarover | Jaipur | Rajasthan   | 300456 |     70070070 | john.doe@gmail.com  |
| Raj        | Jain      | Andheri    | Mumbai | Maharashtra | 456781 |     80808080 | raj.3@gmail.com     |
+------------+-----------+------------+--------+-------------+--------+--------------+---------------------+
3 rows in set (0.00 sec)

mysql>
----------- END OF UC 4 -----------


----------- UC 5 -----------
---- TO DELETE A CONTACT USING THEIR FIRST_NAME----

mysql> delete from addressbook_db where First_Name = "John";
Query OK, 1 row affected (0.07 sec)

mysql> select * from addressbook_db;
+------------+-----------+----------+--------+-------------+--------+--------------+---------------------+
| First_Name | Last_Name | Address  | City   | State       | Zip    | Phone_Number | Email               |
+------------+-----------+----------+--------+-------------+--------+--------------+---------------------+
| Pranshu    | Chaurasia | Talwandi | Kota   | Rajasthan   | 324005 |     90909090 | pranshu.1@gmail.com |
| Raj        | Jain      | Andheri  | Mumbai | Maharashtra | 456781 |     80808080 | raj.3@gmail.com     |
+------------+-----------+----------+--------+-------------+--------+--------------+---------------------+
2 rows in set (0.00 sec)

mysql>
----------- END OF UC 5 -----------