------------- WELCOME TO ADDRESS BOOK MANAGEMENT USING SQL DATABASE -------------

-------------- UC 1 --------------
---- Ability to create a Address Book Service DB ----

mysql> show databases;
+---------------------+
| Database            |
+---------------------+
| demo                |
| demo2               |
| department_database |
| information_schema  |
| mysql               |
| payroll_service     |
| performance_schema  |
| sys                 |
+---------------------+
8 rows in set (0.00 sec)

mysql> create database AddressBook_service;
Query OK, 1 row affected (0.09 sec)

mysql> show databases;
+---------------------+
| Database            |
+---------------------+
| addressbook_service |
| demo                |
| demo2               |
| department_database |
| information_schema  |
| mysql               |
| payroll_service     |
| performance_schema  |
| sys                 |
+---------------------+
9 rows in set (0.00 sec)

mysql>
----------- END OF UC 1 -----------


----------- UC 2 -----------
---- TO CREATE A TABLE WITH FOLLOWING ATTRIBUTES ----

mysql> create table addressBook_db(
    -> First_Name varchar(20),
    -> Last_Name varchar(20),
    -> Address varchar(50),
    -> City varchar(20),
    -> State varchar(50),
    -> Zip int(10),
    -> Phone_Number int(20),
    -> Email varchar(50)
    -> );
Query OK, 0 rows affected, 2 warnings (0.17 sec)

mysql> desc addressbook_db;
+--------------+-------------+------+-----+---------+-------+
| Field        | Type        | Null | Key | Default | Extra |
+--------------+-------------+------+-----+---------+-------+
| First_Name   | varchar(20) | YES  |     | NULL    |       |
| Last_Name    | varchar(20) | YES  |     | NULL    |       |
| Address      | varchar(50) | YES  |     | NULL    |       |
| City         | varchar(20) | YES  |     | NULL    |       |
| State        | varchar(50) | YES  |     | NULL    |       |
| Zip          | int         | YES  |     | NULL    |       |
| Phone_Number | int         | YES  |     | NULL    |       |
| Email        | varchar(50) | YES  |     | NULL    |       |
+--------------+-------------+------+-----+---------+-------+
8 rows in set (0.00 sec)

mysql>
----------- END OF UC 2 -----------


----------- UC 3 -----------
---- TO ADD NEW CONTACTS IN THE ADDRESS BOOK TABLE----

mysql> insert into addressbook_db (First_Name, Last_Name, Address, City, State, Zip, Phone_Number, Email) values("Pranshu", "Chaurasia", "Talwandi", "Kota", "Rajasthan", 324005, 123456, "pranshu.1@gmail.com");
Query OK, 1 row affected (0.10 sec)

mysql> insert into addressbook_db (First_Name, Last_Name, Address, City, State, Zip, Phone_Number, Email) values("John", "Doe", "Mansarover", "Jaipur", "Rajasthan", 300456, 654789, "john.doe@gmail.com");
Query OK, 1 row affected (0.08 sec)

mysql> insert into addressbook_db (First_Name, Last_Name, Address, City, State, Zip, Phone_Number, Email) values("Raj", "Jain", "Andheri", "Mumbai", "Maharashtra", 456781, 321478, "raj.3@gmail.com");
Query OK, 1 row affected (0.09 sec)

mysql> select * from addressbook_db;
+------------+-----------+------------+--------+-------------+--------+--------------+---------------------+
| First_Name | Last_Name | Address    | City   | State       | Zip    | Phone_Number | Email               |
+------------+-----------+------------+--------+-------------+--------+--------------+---------------------+
| Pranshu    | Chaurasia | Talwandi   | Kota   | Rajasthan   | 324005 |       123456 | pranshu.1@gmail.com |
| John       | Doe       | Mansarover | Jaipur | Rajasthan   | 300456 |       654789 | john.doe@gmail.com  |
| Raj        | Jain      | Andheri    | Mumbai | Maharashtra | 456781 |       321478 | raj.3@gmail.com     |
+------------+-----------+------------+--------+-------------+--------+--------------+---------------------+
3 rows in set (0.00 sec)
mysql>
----------- END OF UC 3 -----------


----------- UC 4 -----------
---- TO EDIT ENTRIES IN EXISTING CONTACTS USING THEIR NAME ----

mysql> update addressbook_db set Phone_Number =  90909090 where First_Name = "Pranshu";
Query OK, 1 row affected (0.07 sec)
Rows matched: 1  Changed: 1  Warnings: 0

mysql> update addressbook_db set Phone_Number =  70070070 where First_Name = "John";
Query OK, 1 row affected (0.05 sec)
Rows matched: 1  Changed: 1  Warnings: 0

mysql> update addressbook_db set Phone_Number =  80808080 where First_Name = "Raj";
Query OK, 1 row affected (0.16 sec)
Rows matched: 1  Changed: 1  Warnings: 0

mysql> select * from addressbook_db;
+------------+-----------+------------+--------+-------------+--------+--------------+---------------------+
| First_Name | Last_Name | Address    | City   | State       | Zip    | Phone_Number | Email               |
+------------+-----------+------------+--------+-------------+--------+--------------+---------------------+
| Pranshu    | Chaurasia | Talwandi   | Kota   | Rajasthan   | 324005 |     90909090 | pranshu.1@gmail.com |
| John       | Doe       | Mansarover | Jaipur | Rajasthan   | 300456 |     70070070 | john.doe@gmail.com  |
| Raj        | Jain      | Andheri    | Mumbai | Maharashtra | 456781 |     80808080 | raj.3@gmail.com     |
+------------+-----------+------------+--------+-------------+--------+--------------+---------------------+
3 rows in set (0.00 sec)

mysql>
----------- END OF UC 4 -----------


----------- UC 5 -----------
---- TO DELETE A CONTACT USING THEIR FIRST_NAME----

mysql> delete from addressbook_db where First_Name = "John";
Query OK, 1 row affected (0.07 sec)

mysql> select * from addressbook_db;
+------------+-----------+----------+--------+-------------+--------+--------------+---------------------+
| First_Name | Last_Name | Address  | City   | State       | Zip    | Phone_Number | Email               |
+------------+-----------+----------+--------+-------------+--------+--------------+---------------------+
| Pranshu    | Chaurasia | Talwandi | Kota   | Rajasthan   | 324005 |     90909090 | pranshu.1@gmail.com |
| Raj        | Jain      | Andheri  | Mumbai | Maharashtra | 456781 |     80808080 | raj.3@gmail.com     |
+------------+-----------+----------+--------+-------------+--------+--------------+---------------------+
2 rows in set (0.00 sec)

mysql>
----------- END OF UC 5 -----------


----------- UC 6 -----------
---- TO RETRIEVE DATA OF A CONTACT BELONGING TO A PARTICULAR CITY OR STATE ----

mysql> select * from addressbook_db where City ="Kota" or State = "Rajasthan";
+------------+-----------+----------+------+-----------+--------+--------------+---------------------+
| First_Name | Last_Name | Address  | City | State     | Zip    | Phone_Number | Email               |
+------------+-----------+----------+------+-----------+--------+--------------+---------------------+
| Pranshu    | Chaurasia | Talwandi | Kota | Rajasthan | 324005 |     90909090 | pranshu.1@gmail.com |
+------------+-----------+----------+------+-----------+--------+--------------+---------------------+
1 row in set (0.00 sec)

mysql>
----------- END OF UC 6 -----------


----------- UC 7 -----------
---- TO GET THE SIZE OF ADDRESS BOOK TO GET COUNT OF PERSONS FROM A PARTICULAR CITY/STATE ----

mysql> select count(*) from addressbook_db where City = "Mumbai" or State = "Maharashtra";
+----------+
| count(*) |
+----------+
|        1 |
+----------+
1 row in set (0.00 sec)

mysql>
----------- END OF UC 7 -----------


----------- UC 8 -----------
---- TO SORT DATA ALPHABETICALLY BY NAME AND SHOW IT WITH CITY ----

mysql> select City, First_Name from addressbook_db  order by First_Name ASC;
+--------+------------+
| City   | First_Name |
+--------+------------+
| Kota   | Pranshu    |
| Mumbai | Raj        |
+--------+------------+
2 rows in set (0.00 sec)

mysql>
----------- END OF UC 8 -----------


----------- UC 9 -----------
---- TO CATEGORISE CONTACTS TO FAMILY, FRIENDS AND PROFESSIONAL ----

mysql>  insert into addressbook_db (First_Name, Last_Name, Address, City, State, Zip, Phone_Number, Email) values("John", "Doe", "Mansarover", "Jaipur", "Rajasthan", 300456, 70070707, "john.doe@gmail.com");
Query OK, 1 row affected (0.07 sec)

mysql>  insert into addressbook_db (First_Name, Last_Name, Address, City, State, Zip, Phone_Number, Email) values("Ajay", "Chouhan", "Viman Nagar", "Pune", "Maharashtra", 123421, 67890678, "Ajay@gmail.com");
Query OK, 1 row affected (0.07 sec)

mysql>  insert into addressbook_db (First_Name, Last_Name, Address, City, State, Zip, Phone_Number, Email) values("Rahul", "Roy", "Okhla", "Noida", "Uttar Pradesh", 400433, 98798798, "Naman@gmail.com");
Query OK, 1 row affected (0.08 sec)

mysql>  insert into addressbook_db (First_Name, Last_Name, Address, City, State, Zip, Phone_Number, Email) values("Aditya", "Thakur", "Kurla", "Mumbai", "Maharashtra", 400001, 98098909, "Adi@gmail.com");
Query OK, 1 row affected (0.07 sec)
mysql> select * from addressbook_db;
+------------+-----------+-------------+--------+---------------+--------+--------------+---------------------+
| First_Name | Last_Name | Address     | City   | State         | Zip    | Phone_Number | Email               |
+------------+-----------+-------------+--------+---------------+--------+--------------+---------------------+
| Pranshu    | Chaurasia | Talwandi    | Kota   | Rajasthan     | 324005 |     90909090 | pranshu.1@gmail.com |
| Raj        | Jain      | Andheri     | Mumbai | Maharashtra   | 456781 |     80808080 | raj.3@gmail.com     |
| John       | Doe       | Mansarover  | Jaipur | Rajasthan     | 300456 |     70070707 | john.doe@gmail.com  |
| Ajay       | Chouhan   | Viman Nagar | Pune   | Maharashtra   | 123421 |     67890678 | Ajay@gmail.com      |
| Rahul      | Roy       | Okhla       | Noida  | Uttar Pradesh | 400433 |     98798798 | Naman@gmail.com     |
| Aditya     | Thakur    | Kurla       | Mumbai | Maharashtra   | 400001 |     98098909 | Adi@gmail.com       |
+------------+-----------+-------------+--------+---------------+--------+--------------+---------------------+
6 rows in set (0.00 sec)

mysql>  alter table addressbook_db add Type varchar(20);
Query OK, 0 rows affected (0.10 sec)
Records: 0  Duplicates: 0  Warnings: 0
mysql> select * from addressbook_db;
+------------+-----------+-------------+--------+---------------+--------+--------------+---------------------+------+
| First_Name | Last_Name | Address     | City   | State         | Zip    | Phone_Number | Email               | Type |
+------------+-----------+-------------+--------+---------------+--------+--------------+---------------------+------+
| Pranshu    | Chaurasia | Talwandi    | Kota   | Rajasthan     | 324005 |     90909090 | pranshu.1@gmail.com | NULL |
| Raj        | Jain      | Andheri     | Mumbai | Maharashtra   | 456781 |     80808080 | raj.3@gmail.com     | NULL |
| John       | Doe       | Mansarover  | Jaipur | Rajasthan     | 300456 |     70070707 | john.doe@gmail.com  | NULL |
| Ajay       | Chouhan   | Viman Nagar | Pune   | Maharashtra   | 123421 |     67890678 | Ajay@gmail.com      | NULL |
| Rahul      | Roy       | Okhla       | Noida  | Uttar Pradesh | 400433 |     98798798 | Naman@gmail.com     | NULL |
| Aditya     | Thakur    | Kurla       | Mumbai | Maharashtra   | 400001 |     98098909 | Adi@gmail.com       | NULL |
+------------+-----------+-------------+--------+---------------+--------+--------------+---------------------+------+
6 rows in set (0.00 sec)

mysql> update addressbook_db set type = "Family" where First_Name = "Pranshu" or First_Name = "Rahul";
Query OK, 2 rows affected (0.07 sec)
Rows matched: 2  Changed: 2  Warnings: 0

mysql> update addressbook_db set type = "Friend" where First_Name = "John" or First_Name = "Aditya";
Query OK, 2 rows affected (0.03 sec)
Rows matched: 2  Changed: 2  Warnings: 0

mysql> update addressbook_db set type = "Professional" where First_Name = "Raj" or First_Name = "Ajay";
Query OK, 2 rows affected (0.10 sec)
Rows matched: 2  Changed: 2  Warnings: 0

mysql> select * from addressbook_db;
+------------+-----------+-------------+--------+---------------+--------+--------------+---------------------+--------------+
| First_Name | Last_Name | Address     | City   | State         | Zip    | Phone_Number | Email               | Type         |
+------------+-----------+-------------+--------+---------------+--------+--------------+---------------------+--------------+
| Pranshu    | Chaurasia | Talwandi    | Kota   | Rajasthan     | 324005 |     90909090 | pranshu.1@gmail.com | Family       |
| Raj        | Jain      | Andheri     | Mumbai | Maharashtra   | 456781 |     80808080 | raj.3@gmail.com     | Professional |
| John       | Doe       | Mansarover  | Jaipur | Rajasthan     | 300456 |     70070707 | john.doe@gmail.com  | Friend       |
| Ajay       | Chouhan   | Viman Nagar | Pune   | Maharashtra   | 123421 |     67890678 | Ajay@gmail.com      | Professional |
| Rahul      | Roy       | Okhla       | Noida  | Uttar Pradesh | 400433 |     98798798 | Naman@gmail.com     | Family       |
| Aditya     | Thakur    | Kurla       | Mumbai | Maharashtra   | 400001 |     98098909 | Adi@gmail.com       | Friend       |
+------------+-----------+-------------+--------+---------------+--------+--------------+---------------------+--------------+
6 rows in set (0.00 sec)

mysql>
----------- END OF UC 9 -----------


----------- UC 10 -----------
---- TO GET THE COUNT OF ADDRESSES BY TYPE ----

mysql> update addressbook_db set type = "Family" where First_Name = "Raj";
Query OK, 1 row affected (0.04 sec)
Rows matched: 1  Changed: 1  Warnings: 0

mysql> select * from addressbook_db;
+------------+-----------+-------------+--------+---------------+--------+--------------+---------------------+--------------+
| First_Name | Last_Name | Address     | City   | State         | Zip    | Phone_Number | Email               | Type         |
+------------+-----------+-------------+--------+---------------+--------+--------------+---------------------+--------------+
| Pranshu    | Chaurasia | Talwandi    | Kota   | Rajasthan     | 324005 |     90909090 | pranshu.1@gmail.com | Family       |
| Raj        | Jain      | Andheri     | Mumbai | Maharashtra   | 456781 |     80808080 | raj.3@gmail.com     | Family       |
| John       | Doe       | Mansarover  | Jaipur | Rajasthan     | 300456 |     70070707 | john.doe@gmail.com  | Friend       |
| Ajay       | Chouhan   | Viman Nagar | Pune   | Maharashtra   | 123421 |     67890678 | Ajay@gmail.com      | Professional |
| Rahul      | Roy       | Okhla       | Noida  | Uttar Pradesh | 400433 |     98798798 | Naman@gmail.com     | Family       |
| Aditya     | Thakur    | Kurla       | Mumbai | Maharashtra   | 400001 |     98098909 | Adi@gmail.com       | Friend       |
+------------+-----------+-------------+--------+---------------+--------+--------------+---------------------+--------------+
6 rows in set (0.00 sec)

mysql> select count(*) from table where Type = "Family";
ERROR 1064 (42000): You have an error in your SQL syntax; check the manual that corresponds to your MySQL server version for the right syntax to use near 'table where Type = "Family"' at line 1
mysql> select count(*) from addressbook_db where Type = "Family";
+----------+
| count(*) |
+----------+
|        3 |
+----------+
1 row in set (0.00 sec)

mysql> select count(*) from addressbook_db where Type = "Friend";
+----------+
| count(*) |
+----------+
|        2 |
+----------+
1 row in set (0.00 sec)

mysql> select count(*) from addressbook_db where Type = "Professional";
+----------+
| count(*) |
+----------+
|        1 |
+----------+
1 row in set (0.00 sec)

mysql>
----------- END OF UC 10 -----------


----------- UC 13 -----------
---- RETRIEVING DATA USING TYPE ----
// UC 6 REFRACTORED
mysql> select City ,State, type from addressbook_db where Type = "Family";
+--------+---------------+--------+
| City   | State         | type   |
+--------+---------------+--------+
| Kota   | Rajasthan     | Family |
| Mumbai | Maharashtra   | Family |
| Noida  | Uttar Pradesh | Family |
+--------+---------------+--------+
3 rows in set (0.00 sec)

mysql> select City ,State, type from addressbook_db where Type = "Friend";
+--------+-------------+--------+
| City   | State       | type   |
+--------+-------------+--------+
| Jaipur | Rajasthan   | Friend |
| Mumbai | Maharashtra | Friend |
+--------+-------------+--------+
2 rows in set (0.00 sec)

mysql> select City ,State, type from addressbook_db where Type = "Professional";
+------+-------------+--------------+
| City | State       | type         |
+------+-------------+--------------+
| Pune | Maharashtra | Professional |
+------+-------------+--------------+
1 row in set (0.00 sec)

// UC 7 refractored

mysql> select count(city), count(State) from addressbook_db where type = "Professional";
+-------------+--------------+
| count(city) | count(State) |
+-------------+--------------+
|           1 |            1 |
+-------------+--------------+
1 row in set (0.00 sec)

mysql> select count(city), count(State) from addressbook_db where type = "Friend";
+-------------+--------------+
| count(city) | count(State) |
+-------------+--------------+
|           2 |            2 |
+-------------+--------------+
1 row in set (0.00 sec)

mysql> select count(city), count(State) from addressbook_db where type = "Family";
+-------------+--------------+
| count(city) | count(State) |
+-------------+--------------+
|           3 |            3 |
+-------------+--------------+
1 row in set (0.00 sec)

// ORDER BY NAME UC 8
mysql> select First_Name, City, Type from addressbook_db order by First_Name asc;
+------------+--------+--------------+
| First_Name | City   | Type         |
+------------+--------+--------------+
| Aditya     | Mumbai | Friend       |
| Ajay       | Pune   | Professional |
| John       | Jaipur | Friend       |
| Pranshu    | Kota   | Family       |
| Rahul      | Noida  | Family       |
| Raj        | Mumbai | Family       |
+------------+--------+--------------+
6 rows in set (0.00 sec)
----------- END OF UC 13 -----------